{
  "schema_version": 1,
  "api_version": 65536,
  "id": "m014-sidecar",
  "title": "破晓密令 · 扩展任务",
  "selector_level": 15,
  "engine_mission": 7,
  "executable_sha256": "F4DD1131DF6C993C01EA011F9439BC725E6DC6491B5FBBA47724D7D5B64DA3F3",
  "executable_file_size": 1114162,
  "executable_pe_timestamp": 988397542,
  "objectives": [
    {
      "id": "contact",
      "title": "与晨市交通员接头",
      "description": "先取得两名关键人物的身份与巡逻情报。",
      "event": "Interacted",
      "target_database_id": 1018,
      "subject_database_id": 924
    },
    {
      "id": "orders",
      "title": "截获伪警备队口令",
      "description": "处置伪警备队联络官并截获口令。",
      "event": "Killed",
      "depends_on": [
        "contact"
      ],
      "target_database_id": 927
    },
    {
      "id": "plan",
      "title": "截获日军封锁布防图",
      "description": "处置日军封锁顾问并取得布防图。",
      "event": "Killed",
      "depends_on": [
        "contact"
      ],
      "target_database_id": 933
    },
    {
      "id": "evacuate",
      "title": "从镇东交通口撤离",
      "description": "携带情报前往镇东秘密交通口。",
      "event": "Evacuated",
      "depends_on": [
        "orders",
        "plan"
      ],
      "subject_database_id": 924,
      "region": {
        "x": 3056,
        "y": 1808,
        "radius": 80
      }
    },
    {
      "id": "player-fallen",
      "title": "强子阵亡",
      "description": "强子必须生还。",
      "event": "Killed",
      "failure": true,
      "failure_reason": "强子阵亡，破晓密令失败。",
      "target_database_id": 924
    }
  ]
}
