{
  "schema_version": 1,
  "api_version": 65536,
  "id": "m012-sidecar",
  "title": "余烬行动 · 扩展任务",
  "selector_level": 13,
  "engine_mission": 12,
  "executable_sha256": "F4DD1131DF6C993C01EA011F9439BC725E6DC6491B5FBBA47724D7D5B64DA3F3",
  "executable_file_size": 1114162,
  "executable_pe_timestamp": 988397542,
  "objectives": [
    {
      "id": "destroy-nodes",
      "title": "破坏六处补给节点",
      "description": "机场各区的油料、通信和弹药节点使用同类设施，逐一爆破。",
      "event": "Exploded",
      "required_count": 6,
      "target_database_id": 1019
    },
    {
      "id": "commander",
      "title": "处置机场指挥官",
      "description": "这是可选目标，指挥官会在北部巡逻。",
      "event": "Killed",
      "optional": true,
      "target_database_id": 926
    },
    {
      "id": "evacuate",
      "title": "从西北排水口撤离",
      "description": "完成破坏后到达西北撤离点。",
      "event": "Evacuated",
      "depends_on": [
        "destroy-nodes"
      ],
      "subject_database_id": 924,
      "region": {
        "x": 48,
        "y": 416,
        "radius": 80
      }
    },
    {
      "id": "qiangzi-fallen",
      "title": "强子阵亡",
      "description": "强子必须生还。",
      "event": "Killed",
      "failure": true,
      "failure_reason": "强子阵亡，余烬行动失败。",
      "target_database_id": 924
    },
    {
      "id": "laozhao-fallen",
      "title": "老赵阵亡",
      "description": "老赵必须生还。",
      "event": "Killed",
      "failure": true,
      "failure_reason": "老赵阵亡，余烬行动失败。",
      "target_database_id": 918
    }
  ]
}
